{
  "version": 1,
  "source": {
    "name": "infinite-wonder.mp3",
    "duration": 190.066958,
    "sample_rate": 44100,
    "channels": 2
  },
  "license": {
    "name": "CC0 1.0",
    "url": "https://creativecommons.org/publicdomain/zero/1.0/"
  },
  "tracker": "beat_this final0",
  "tempo": {
    "bpm": null,
    "beats_per_bar": null
  },
  "beats": [],
  "downbeats": [],
  "sections": [
    {
      "start": 0.0,
      "end": 189.6,
      "loudness": -21.8
    }
  ],
  "loudness": [
    -34.1,
    -34.1,
    -29.7,
    -27.9,
    -27.2,
    -27.1,
    -26.7,
    -27.1,
    -26.8,
    -26.3,
    -26.0,
    -25.5,
    -25.1,
    -24.9,
    -25.7,
    -26.5,
    -26.8,
    -26.8,
    -27.2,
    -27.5,
    -27.4,
    -27.3,
    -26.4,
    -25.6,
    -25.1,
    -25.6,
    -24.4,
    -22.8,
    -21.2,
    -20.5,
    -19.4,
    -19.1,
    -18.7,
    -18.5,
    -18.5,
    -18.9,
    -19.2,
    -18.8,
    -18.4,
    -18.7,
    -19.3,
    -19.7,
    -20.1,
    -19.7,
    -19.6,
    -19.6,
    -20.0,
    -20.1,
    -19.8,
    -19.8,
    -19.9,
    -20.0,
    -20.1,
    -20.0,
    -19.0,
    -18.5,
    -18.5,
    -19.2,
    -19.4,
    -19.9,
    -20.6,
    -21.1,
    -20.8,
    -20.4,
    -19.6,
    -19.5,
    -19.9,
    -20.7,
    -20.2,
    -19.4,
    -18.2,
    -18.2,
    -18.4,
    -19.3,
    -19.7,
    -19.8,
    -20.1,
    -21.3,
    -22.7,
    -23.3,
    -22.8,
    -22.4,
    -22.4,
    -22.4,
    -22.2,
    -21.5,
    -20.5,
    -20.4,
    -20.5,
    -21.4,
    -21.9,
    -23.1,
    -23.5,
    -23.5,
    -23.5,
    -23.2,
    -22.7,
    -21.8,
    -21.4,
    -21.3,
    -21.1,
    -20.7,
    -20.0,
    -19.6,
    -19.2,
    -19.8,
    -20.1,
    -20.9,
    -20.2,
    -21.0,
    -21.1,
    -21.6,
    -20.9,
    -20.4,
    -20.1,
    -20.4,
    -21.1,
    -22.3,
    -22.2,
    -22.1,
    -22.7,
    -24.1,
    -25.7,
    -25.5,
    -25.9,
    -26.3,
    -26.9,
    -26.9,
    -26.8,
    -27.5,
    -26.9,
    -27.4,
    -26.8,
    -26.9,
    -26.4,
    -27.0,
    -27.1,
    -27.0,
    -26.7,
    -27.2,
    -28.1,
    -29.3,
    -29.9,
    -30.0,
    -28.8,
    -27.2,
    -25.5,
    -24.9,
    -24.4,
    -24.9,
    -25.1,
    -24.9,
    -23.7,
    -23.1,
    -23.0,
    -23.6,
    -22.9,
    -22.2,
    -21.8,
    -22.4,
    -23.4,
    -24.4,
    -24.6,
    -25.0,
    -25.7,
    -27.2,
    -27.1,
    -25.1,
    -23.9,
    -23.3,
    -22.7,
    -22.3,
    -22.2,
    -22.7,
    -22.7,
    -22.0,
    -21.2,
    -21.2,
    -21.2,
    -21.4,
    -21.7,
    -22.2,
    -21.2,
    -19.7,
    -18.1,
    -17.8,
    -19.0,
    -22.5,
    -34.4,
    -35.2,
    -35.2
  ],
  "end": 189.6
}
