{
  "version": 1,
  "source": {
    "name": "pond.mp3",
    "duration": 152.398375,
    "sample_rate": 44100,
    "channels": 2
  },
  "license": {
    "name": "CC0 1.0",
    "url": "https://creativecommons.org/publicdomain/zero/1.0/"
  },
  "tracker": "beat_this final0",
  "tempo": {
    "bpm": 119.717,
    "beats_per_bar": 6
  },
  "beats": [
    0.34,
    0.86,
    1.36,
    1.88,
    2.38,
    2.86,
    3.36,
    3.88,
    4.36,
    4.62,
    4.86,
    5.38,
    5.86,
    6.36,
    6.86,
    7.36,
    7.86,
    8.36,
    8.86,
    9.12,
    9.36,
    9.88,
    10.36,
    10.62,
    10.86,
    11.36,
    11.86,
    12.36,
    12.86,
    13.36,
    13.86,
    14.36,
    14.86,
    15.36,
    15.86,
    16.36,
    16.86,
    17.36,
    17.86,
    18.36,
    18.86,
    19.36,
    19.86,
    20.36,
    20.86,
    21.12,
    21.36,
    21.86,
    22.36,
    22.86,
    23.36,
    23.86,
    24.36,
    24.62,
    24.86,
    25.12,
    25.36,
    25.62,
    25.86,
    26.14,
    26.36,
    26.62,
    26.86,
    27.14,
    27.38,
    27.62,
    27.88,
    28.12,
    28.36,
    28.62,
    28.86,
    29.12,
    29.38,
    29.62,
    29.88,
    30.14,
    30.38,
    30.64,
    30.88,
    31.14,
    31.38,
    31.64,
    31.88,
    32.14,
    32.38,
    32.64,
    32.88,
    33.14,
    33.38,
    33.88,
    34.12,
    34.38,
    34.64,
    34.88,
    35.38,
    35.64,
    35.88,
    36.14,
    36.36,
    36.64,
    36.88,
    37.12,
    37.38,
    37.64,
    37.88,
    38.38,
    38.64,
    38.88,
    39.14,
    39.38,
    39.64,
    39.88,
    40.38,
    40.64,
    40.88,
    41.38,
    41.64,
    41.88,
    42.14,
    42.38,
    42.64,
    42.88,
    43.14,
    43.38,
    43.88,
    44.14,
    44.38,
    44.64,
    44.88,
    45.14,
    45.38,
    45.64,
    45.88,
    46.38,
    46.66,
    46.88,
    47.14,
    47.38,
    47.64,
    47.88,
    48.14,
    48.38,
    48.64,
    48.88,
    49.14,
    49.38,
    49.64,
    49.88,
    50.14,
    50.38,
    50.64,
    50.88,
    51.14,
    51.38,
    51.64,
    51.88,
    52.14,
    52.3,
    52.38,
    52.64,
    52.88,
    53.16,
    53.4,
    53.64,
    53.9,
    54.14,
    54.38,
    54.64,
    54.9,
    55.14,
    55.38,
    55.64,
    55.9,
    56.14,
    56.4,
    56.64,
    56.88,
    57.14,
    57.38,
    57.64,
    57.9,
    58.14,
    58.3,
    58.4,
    58.64,
    58.88,
    59.14,
    59.4,
    59.88,
    60.14,
    60.36,
    60.88,
    61.38,
    61.64,
    61.88,
    62.38,
    62.64,
    62.88,
    63.38,
    63.88,
    64.38,
    64.64,
    64.88,
    65.38,
    65.64,
    65.88,
    66.14,
    66.38,
    66.88,
    67.38,
    67.64,
    67.88,
    68.38,
    68.64,
    68.88,
    69.14,
    69.38,
    69.64,
    69.88,
    70.38,
    70.64,
    70.88,
    71.38,
    71.64,
    71.88,
    72.14,
    72.38,
    72.88,
    73.38,
    73.88,
    74.38,
    74.64,
    74.88,
    75.14,
    75.38,
    75.88,
    76.38,
    76.88,
    77.38,
    77.88,
    78.14,
    78.38,
    78.66,
    78.88,
    79.38,
    79.88,
    80.14,
    80.38,
    80.88,
    81.14,
    81.38,
    81.64,
    81.88,
    82.38,
    82.64,
    82.88,
    83.38,
    83.88,
    84.14,
    84.36,
    84.88,
    85.38,
    85.88,
    86.38,
    86.64,
    86.88,
    87.14,
    87.38,
    87.88,
    88.14,
    88.38,
    88.64,
    88.88,
    89.4,
    89.9,
    90.38,
    90.9,
    91.4,
    91.9,
    92.4,
    92.9,
    93.16,
    93.4,
    93.9,
    94.4,
    94.9,
    95.4,
    95.9,
    96.4,
    96.9,
    97.4,
    97.9,
    98.4,
    98.66,
    98.9,
    99.16,
    99.4,
    99.66,
    99.9,
    100.4,
    100.64,
    100.9,
    101.4,
    101.9,
    102.16,
    102.4,
    102.9,
    103.4,
    103.9,
    104.4,
    104.9,
    105.4,
    105.9,
    106.4,
    106.9,
    107.4,
    107.9,
    108.14,
    108.38,
    108.9,
    109.38,
    109.9,
    110.4,
    110.66,
    110.8,
    110.9,
    111.4,
    111.9,
    112.3,
    112.4,
    112.66,
    112.9,
    113.4,
    113.8,
    113.9,
    114.4,
    114.8,
    114.9,
    115.3,
    115.4,
    115.9,
    116.3,
    116.4,
    116.9,
    117.16,
    117.4,
    117.8,
    117.9,
    118.3,
    118.4,
    118.66,
    118.9,
    119.38,
    119.88,
    120.38,
    120.88,
    121.38,
    121.88,
    122.38,
    122.9,
    123.38,
    123.88,
    124.38,
    124.88,
    125.38,
    125.88,
    126.3,
    126.38,
    126.8,
    126.88,
    127.38,
    127.9,
    128.3,
    128.4,
    128.88,
    129.4,
    129.8,
    129.9,
    130.3,
    130.38,
    130.88,
    131.38,
    131.88,
    132.36,
    132.88,
    133.3,
    133.38,
    133.8,
    133.88,
    134.4,
    134.8,
    134.88,
    135.38,
    135.88,
    136.38,
    136.88,
    137.38,
    137.8,
    137.88,
    138.38,
    138.8,
    138.88,
    139.3,
    139.38,
    139.88,
    140.3,
    140.38,
    140.88,
    141.38,
    141.8,
    141.88,
    142.3,
    142.38,
    142.88,
    143.3,
    143.4,
    143.8,
    143.9,
    144.38,
    144.9,
    145.4,
    145.9,
    146.44,
    146.94,
    147.44,
    147.96,
    148.4,
    148.94
  ],
  "downbeats": [
    0.34,
    1.88,
    3.36,
    6.36,
    7.86,
    9.36,
    12.36,
    13.86,
    15.36,
    18.36,
    19.86,
    21.36,
    24.36,
    25.86,
    27.38,
    28.86,
    30.38,
    31.88,
    33.38,
    36.36,
    37.88,
    39.38,
    40.88,
    42.38,
    45.38,
    48.38,
    51.38,
    52.88,
    54.38,
    57.38,
    58.88,
    60.36,
    62.38,
    63.38,
    66.38,
    69.38,
    72.38,
    75.38,
    78.38,
    81.38,
    84.36,
    87.38,
    88.88,
    90.38,
    92.4,
    94.4,
    96.4,
    98.4,
    99.4,
    102.4,
    104.4,
    105.4,
    108.38,
    110.4,
    111.4,
    114.4,
    116.3,
    116.4,
    117.4,
    118.9,
    120.38,
    122.38,
    123.38,
    126.3,
    126.38,
    129.4,
    132.36,
    134.4,
    135.38,
    138.38,
    140.38,
    141.38,
    144.38,
    146.44,
    148.4
  ],
  "sections": [
    {
      "start": 0.0,
      "end": 24.36,
      "loudness": -20.1
    },
    {
      "start": 24.36,
      "end": 48.38,
      "loudness": -18.9
    },
    {
      "start": 48.38,
      "end": 116.3,
      "loudness": -15.1
    },
    {
      "start": 116.3,
      "end": 120.38,
      "loudness": -15.4
    },
    {
      "start": 120.38,
      "end": 150.05,
      "loudness": -16.7
    }
  ],
  "loudness": [
    -21.3,
    -21.3,
    -22.4,
    -22.3,
    -22.5,
    -19.9,
    -19.1,
    -18.9,
    -20.7,
    -21.4,
    -21.6,
    -20.0,
    -20.2,
    -20.3,
    -22.4,
    -22.6,
    -21.6,
    -20.2,
    -18.4,
    -18.2,
    -18.1,
    -18.7,
    -19.0,
    -18.9,
    -19.5,
    -19.6,
    -20.4,
    -20.5,
    -20.8,
    -18.9,
    -18.2,
    -17.9,
    -19.5,
    -20.1,
    -20.3,
    -18.9,
    -18.8,
    -18.8,
    -20.3,
    -20.7,
    -20.3,
    -18.4,
    -17.1,
    -16.8,
    -17.2,
    -17.9,
    -18.3,
    -18.3,
    -17.9,
    -17.3,
    -17.3,
    -17.3,
    -17.2,
    -15.9,
    -15.2,
    -14.9,
    -16.0,
    -17.0,
    -17.1,
    -16.2,
    -15.9,
    -15.8,
    -16.3,
    -15.7,
    -15.4,
    -14.4,
    -13.7,
    -13.3,
    -13.1,
    -12.8,
    -12.9,
    -13.8,
    -15.5,
    -16.4,
    -16.1,
    -15.5,
    -15.3,
    -14.2,
    -13.9,
    -13.7,
    -14.5,
    -15.4,
    -15.3,
    -15.1,
    -15.2,
    -15.8,
    -16.5,
    -15.9,
    -15.3,
    -14.1,
    -13.4,
    -13.2,
    -13.1,
    -12.9,
    -12.9,
    -13.7,
    -15.5,
    -16.7,
    -17.0,
    -16.2,
    -15.8,
    -14.9,
    -14.7,
    -14.4,
    -14.8,
    -15.4,
    -15.9,
    -16.3,
    -16.5,
    -16.8,
    -16.8,
    -16.2,
    -15.7,
    -15.3,
    -14.8,
    -14.5,
    -14.4,
    -14.8,
    -15.1,
    -16.1,
    -17.1,
    -18.2,
    -17.8,
    -17.1,
    -16.6,
    -15.8,
    -15.5,
    -15.2,
    -15.9,
    -16.5,
    -17.0,
    -17.2,
    -17.6,
    -18.0,
    -18.3,
    -17.2,
    -16.6,
    -15.7,
    -15.2,
    -14.9,
    -15.1,
    -15.8,
    -16.3,
    -17.2,
    -19.0,
    -21.8,
    -27.8,
    -30.2,
    -31.3,
    -33.2,
    -36.9,
    -44.6,
    -44.6
  ],
  "end": 150.05
}
